{"causal_work_id":"code-review:F-OPERATOR-V03-FI-UNKNOWN-TAKEOVER-0003:review","created_at":"2026-09-27T10:15:32Z","effect_kind":"worker-dispatch","effect_lineage_id":"lin-ed8e81221b4909deb33003a6a81fbfeafc46268011317f08","external_effect_scope":"vertical-worker-dispatch","feature_id":"F-OPERATOR-V03-FI-UNKNOWN-TAKEOVER-0003","operation_profile":"vertical-implementation-review-qa/v1","role":"reviewer","schema_version":"ai-sdlc.effect-lineage/v1","target_repository":"dream-xin/ai-sdlc","trusted_context_digest":"1decf1fdada7327e391a7416ad6eb15d5c52d9cd46f1c14b7ed9ac70a5fdc6e8"}
