{"causal_work_id":"code-review:F-OPERATOR-V03-REAL-RUNTIME-FI-0027:review","created_at":"2026-09-26T14:48:19Z","effect_kind":"worker-dispatch","effect_lineage_id":"lin-00d028f4f5ee45e3e6428bed01e81543fc45debc48a616c8","external_effect_scope":"vertical-worker-dispatch","feature_id":"F-OPERATOR-V03-REAL-RUNTIME-FI-0027","operation_profile":"vertical-implementation-review-qa/v1","role":"reviewer","schema_version":"ai-sdlc.effect-lineage/v1","target_repository":"dream-xin/ai-sdlc","trusted_context_digest":"6f7739da3d5e40a011264dfc6a50433280f338f7c3a173459f9cac3a7b0a0155"}
