{"causal_work_id":"code-review:F-OPERATOR-V03-FI-PREAUTH-CRASH-0004:review","created_at":"2026-10-02T14:42:08Z","effect_kind":"worker-dispatch","effect_lineage_id":"lin-0c077e9eae8dfc9592a69c49ec36cfd7ea7beb7f5efe4ba8","external_effect_scope":"vertical-worker-dispatch","feature_id":"F-OPERATOR-V03-FI-PREAUTH-CRASH-0004","operation_profile":"vertical-implementation-review-qa/v1","role":"reviewer","schema_version":"ai-sdlc.effect-lineage/v1","target_repository":"dream-xin/ai-sdlc","trusted_context_digest":"d80ef035cb5409caf7958cdf18dedeb3365abdfb40e5ed2ec2104cbf5758a28c"}
