{"causal_work_id":"verification:F-OPERATOR-V03-DOGFOOD-HAPPY-0001:qa","created_at":"2026-10-10T18:08:05Z","effect_kind":"worker-dispatch","effect_lineage_id":"lin-955d611c1ddae1efdf5cb3bd942716d94bbb81b5b7cf9327","external_effect_scope":"vertical-worker-dispatch","feature_id":"F-OPERATOR-V03-DOGFOOD-HAPPY-0001","operation_profile":"vertical-implementation-review-qa/v1","role":"qa","schema_version":"ai-sdlc.effect-lineage/v1","target_repository":"dream-xin/ai-sdlc","trusted_context_digest":"51ebeec84568484d36d25ce1d613da8bb95547a3d5b53a9925225dfa3da25310"}
