{"causal_work_id":"code-review:F-OPERATOR-V03-FI-PERSIST-BEFORE-CANCEL-0001:review","created_at":"2026-10-02T10:28:34Z","effect_kind":"worker-dispatch","effect_lineage_id":"lin-642ac8fca02d71d4afa2547cca47c4236e7c61d23a884913","external_effect_scope":"vertical-worker-dispatch","feature_id":"F-OPERATOR-V03-FI-PERSIST-BEFORE-CANCEL-0001","operation_profile":"vertical-implementation-review-qa/v1","role":"reviewer","schema_version":"ai-sdlc.effect-lineage/v1","target_repository":"dream-xin/ai-sdlc","trusted_context_digest":"696767af369cf7291c016ce5e3a5987fb053b601f172028b595be5269c62b2b6"}
