{"causal_work_id":"code-review:F-OPERATOR-V03-FI-DUPLICATE-CALLBACK-0001:review","created_at":"2026-10-02T10:37:47Z","effect_kind":"worker-dispatch","effect_lineage_id":"lin-551924e782b2dfc817a24227fb71a23f1e2f33a1ea52dd03","external_effect_scope":"vertical-worker-dispatch","feature_id":"F-OPERATOR-V03-FI-DUPLICATE-CALLBACK-0001","operation_profile":"vertical-implementation-review-qa/v1","role":"reviewer","schema_version":"ai-sdlc.effect-lineage/v1","target_repository":"dream-xin/ai-sdlc","trusted_context_digest":"4433e4f9590a4748529377914cfff30a346eedf4165d4e54353e85f73b2c5c81"}
