{"causal_work_id":"code-review:F-OPERATOR-V03-FI-STALE-CANDIDATE-0002:review","created_at":"2026-10-02T13:48:21Z","effect_kind":"worker-dispatch","effect_lineage_id":"lin-15df4145b4e015c5635af88bf0bc9a358f05a7d37388e12b","external_effect_scope":"vertical-worker-dispatch","feature_id":"F-OPERATOR-V03-FI-STALE-CANDIDATE-0002","operation_profile":"vertical-implementation-review-qa/v1","role":"reviewer","schema_version":"ai-sdlc.effect-lineage/v1","target_repository":"dream-xin/ai-sdlc","trusted_context_digest":"3090cb3c7eb6ab864d269b32836234faa2cffe815ecaf7a401676f785533b6d9"}
