{"causal_work_id":"code-review:F-OPERATOR-V03-FI-DUPLICATE-WORKER-0003:review","created_at":"2026-10-02T15:45:04Z","effect_kind":"worker-dispatch","effect_lineage_id":"lin-b54c9234eccd798d8694f8446a95682ba4cfab0b4766bda0","external_effect_scope":"vertical-worker-dispatch","feature_id":"F-OPERATOR-V03-FI-DUPLICATE-WORKER-0003","operation_profile":"vertical-implementation-review-qa/v1","role":"reviewer","schema_version":"ai-sdlc.effect-lineage/v1","target_repository":"dream-xin/ai-sdlc","trusted_context_digest":"4a925fbc7cfb719f649ebc9295cca506a7879606f9164fe28519ff1f5a2f5707"}
